{
  "$schema": "./kubernetes-feature-graduation.schema.json",
  "schemaVersion": 2,
  "policyVersion": 4,
  "lifecycleAuthority": "docs/FeatureStatus.md",
  "evidenceSchema": "devops/config/kubernetes-feature-graduation-evidence.schema.json",
  "supportContract": {
    "kubernetes": {
      "range": ">=1.34.0-0 <1.38.0-0",
      "minors": [
        {
          "minor": "1.34",
          "ciVersion": "v1.34.11",
          "kindNodeImage": "kindest/node:v1.34.11@sha256:44e222ee2132dab25ff87301682f89eb82c7880ea3a1bf543bfe9708fd08d67d"
        },
        {
          "minor": "1.35",
          "ciVersion": "v1.35.8",
          "kindNodeImage": "kindest/node:v1.35.8@sha256:07b2536e30b803ed61d1677a79df6115f798ce64c80f9e22f6ed45afd09323c0"
        },
        {
          "minor": "1.36",
          "ciVersion": "v1.36.4",
          "kindNodeImage": "kindest/node:v1.36.4@sha256:099e049362a1526b2db71494e1947aae99bd16290d7c895f2b7ea312e3cbfaed"
        },
        {
          "minor": "1.37",
          "ciVersion": "v1.37.0",
          "kindNodeImage": "kindest/node:v1.37.0@sha256:a1ed56cfb0e7b93589bdf97c8cd566405a265939e3620fc4f5de89adff580ae5"
        }
      ]
    },
    "helm": {
      "versions": [
        "3.22.1",
        "4.3.1"
      ],
      "upgradeCompatibility": "clean-install-upgrade-rollback-uninstall"
    },
    "gatewayApi": {
      "version": "v1.6.2",
      "channel": "standard",
      "servedVersion": "v1",
      "standardInstallUrl": "https://github.com/kubernetes-sigs/gateway-api/releases/download/v1.6.2/standard-install.yaml",
      "standardInstallSha256": "faede450fa178126aba41337737b97d351ebe87d93c910237ce1e072d1ca40d9"
    },
    "crdLifecycle": {
      "owner": "operator",
      "chartInstalls": false,
      "chartConverts": false,
      "chartDeletes": false,
      "supportedUpgradeOrder": [
        "apply and establish the pinned standard CRD bundle",
        "upgrade the Gateway controller",
        "upgrade the selected data-plane workload"
      ]
    },
    "controllerDataPlaneSkew": {
      "defaultMode": "exact",
      "rollingMode": "rolling_upgrade",
      "maximumRollingHours": 24,
      "upgradeOrder": [
        "set rolling_upgrade with an explicit version from the immediately preceding minor and a deadline",
        "upgrade the controller before the data plane",
        "restore exact mode after convergence"
      ],
      "rollbackOrder": [
        "keep rolling_upgrade active while both permitted versions exist",
        "roll back the data plane before the controller",
        "restore exact mode after convergence"
      ]
    },
    "architectures": [
      {
        "name": "linux/amd64",
        "nativeClusterRequired": true,
        "qualification": "pending"
      },
      {
        "name": "linux/arm64",
        "nativeClusterRequired": true,
        "qualification": "pending"
      },
      {
        "name": "linux/riscv64",
        "nativeClusterRequired": true,
        "qualification": "blocked"
      }
    ],
    "networking": {
      "ipFamilies": [
        "IPv4"
      ],
      "networkPolicyCnis": [
        "Calico",
        "Cilium"
      ]
    },
    "podSecurity": {
      "standard": "restricted",
      "mode": "enforce",
      "version": "latest"
    }
  },
  "cadences": [
    {
      "id": "pull_request",
      "purpose": "Validate the policy, documentation, charts, Kubernetes floor end-to-end path, ceiling smoke path, and fail-closed diagnostics."
    },
    {
      "id": "nightly",
      "purpose": "Exercise every Kubernetes minor and Helm line, both NetworkPolicy CNIs, fault recovery, propagation, rotation, and a bounded one-hour soak."
    },
    {
      "id": "release_candidate",
      "purpose": "Produce exact-revision promotion evidence for every mandatory gate, architecture, conformance profile, previous-minor path, and eight-hour soak."
    },
    {
      "id": "stable",
      "purpose": "Verify and consume the exact release-candidate evidence without rebuilding or accepting mutable references."
    }
  ],
  "blockers": [
    {
      "id": "previous-stable-role-topology",
      "reason": "No eligible previous stable release currently provides the complete controller and data-plane role topology required for released-artifact upgrade and rollback evidence."
    },
    {
      "id": "native-riscv64-cluster-runner",
      "reason": "No native RISC-V Kubernetes worker is available; QEMU user-mode image smoke is not Kubernetes qualification evidence."
    }
  ],
  "gates": [
    {
      "id": "policy-contract",
      "objective": "The registry, generated support tables, feature lifecycle matrix, release contract, charts, and workflow topology agree.",
      "cadence": "pull_request",
      "mandatory": true,
      "appliesTo": [
        "gateway-controller",
        "gateway-api-httproute",
        "gateway-api-grpcroute",
        "gateway-api-tlsroute",
        "gateway-api-tcproute",
        "gateway-api-udproute",
        "gateway-api-backendtlspolicy",
        "gateway-api-weighted-discovery",
        "gateway-api-standard-filters-backend-tls",
        "gateway-api-route-policy",
        "gateway-controller-multi-target",
        "gateway-controller-explain",
        "supply-chain-admission-bundle",
        "helm-data-plane",
        "helm-gateway-controller"
      ]
    },
    {
      "id": "unsupported-combination-diagnostics",
      "objective": "Helm, controller readiness, support metadata, and operator diagnostics reject or clearly identify every unsupported Kubernetes, Gateway API, architecture, and skew combination.",
      "cadence": "pull_request",
      "mandatory": true,
      "appliesTo": [
        "gateway-controller",
        "gateway-api-httproute",
        "gateway-api-grpcroute",
        "gateway-api-tlsroute",
        "gateway-api-tcproute",
        "gateway-api-udproute",
        "gateway-api-backendtlspolicy",
        "gateway-api-weighted-discovery",
        "gateway-api-standard-filters-backend-tls",
        "gateway-api-route-policy",
        "gateway-controller-multi-target",
        "gateway-controller-explain",
        "supply-chain-admission-bundle",
        "helm-data-plane",
        "helm-gateway-controller"
      ]
    },
    {
      "id": "clean-lifecycle",
      "objective": "Clean install, same-version upgrade, rollback, and uninstall converge while operator-owned Gateway API CRDs and retained immutable rollback objects follow the documented ownership contract.",
      "cadence": "release_candidate",
      "mandatory": true,
      "appliesTo": [
        "gateway-controller",
        "gateway-controller-multi-target",
        "helm-data-plane",
        "helm-gateway-controller"
      ]
    },
    {
      "id": "leader-election-failover",
      "objective": "Leader deletion, follower takeover, Lease deletion and recreation, and stale-writer fencing preserve a single active writer with takeover within 45 seconds.",
      "cadence": "nightly",
      "mandatory": true,
      "appliesTo": [
        "gateway-controller",
        "gateway-controller-multi-target",
        "helm-gateway-controller"
      ]
    },
    {
      "id": "api-outage-recovery",
      "objective": "A bounded Kubernetes API outage and leader-only API partition produce no unproved writes and recover reconciliation within 90 seconds after connectivity returns.",
      "cadence": "nightly",
      "mandatory": true,
      "appliesTo": [
        "gateway-controller",
        "gateway-controller-multi-target",
        "helm-gateway-controller"
      ]
    },
    {
      "id": "watch-reconnect-compaction",
      "objective": "Watch close, timeout, error events, and HTTP 410 resource-version compaction trigger a fresh list or GET without stale authority.",
      "cadence": "pull_request",
      "mandatory": true,
      "appliesTo": [
        "gateway-controller",
        "gateway-api-weighted-discovery",
        "gateway-api-route-policy",
        "gateway-controller-multi-target"
      ]
    },
    {
      "id": "stale-object-convergence",
      "objective": "Accepted, rejected, deleted, and corrected Gateway API objects converge to fresh status and configuration without preserving stale authority.",
      "cadence": "nightly",
      "mandatory": true,
      "appliesTo": [
        "gateway-controller",
        "gateway-api-httproute",
        "gateway-api-grpcroute",
        "gateway-api-tlsroute",
        "gateway-api-tcproute",
        "gateway-api-udproute",
        "gateway-api-backendtlspolicy",
        "gateway-api-weighted-discovery",
        "gateway-api-standard-filters-backend-tls",
        "gateway-api-route-policy",
        "gateway-controller-multi-target",
        "gateway-controller-explain"
      ]
    },
    {
      "id": "partial-rollout-recovery",
      "objective": "A stalled, rejected, or partially Ready candidate never commits and restores the last committed revision before a distinct candidate may proceed.",
      "cadence": "pull_request",
      "mandatory": true,
      "appliesTo": [
        "gateway-controller",
        "gateway-controller-multi-target",
        "gateway-controller-explain",
        "helm-data-plane",
        "helm-gateway-controller"
      ]
    },
    {
      "id": "network-partition",
      "objective": "Controller-to-API and multi-node partitions preserve fencing, readiness, and last-committed configuration guarantees and recover within the documented bounds.",
      "cadence": "nightly",
      "mandatory": true,
      "appliesTo": [
        "gateway-controller",
        "gateway-controller-multi-target",
        "helm-data-plane",
        "helm-gateway-controller"
      ]
    },
    {
      "id": "configmap-propagation",
      "objective": "Base configuration, generated configuration, and BackendTLSPolicy public-CA ConfigMap changes create and converge the expected immutable revision within 300 seconds.",
      "cadence": "nightly",
      "mandatory": true,
      "appliesTo": [
        "gateway-controller",